<!ELEMENT students (student+)>
<!ELEMENT student (name, course, year, marks)>
<!ATTLIST student id CDATA #REQUIRED>
<!ELEMENT name (#PCDATA)>
<!ELEMENT course (#PCDATA)>
<!ELEMENT year (#PCDATA)>
<!ELEMENT marks (#PCDATA)>
